<?xml version="1.0" encoding="UTF-8"?>
<!DOCTYPE empleados SYSTEM "empleados.dtd">
<empleados>
    <empleado>
        <id>1</id>
        <nombre>Juan Pérez</nombre>
        <edad>30</edad>
        <departamento>Recursos Humanos</departamento>
        <salario>2500.00</salario>
    </empleado>
    <empleado>
        <id>2</id>
        <nombre>María López</nombre>
        <edad>28</edad>
        <departamento>Marketing</departamento>
        <salario>3000.00</salario>
    </empleado>
    <empleado>
        <id>3</id>
        <nombre>Carlos García</nombre>
        <edad>35</edad>
        <departamento>TI</departamento>
        <salario>4000.00</salario>
    </empleado>
</empleados>
